{
  "schema_version": "1.1.0",
  "design_id": "learnpilot-rag-hybrid-rerank-ablation-design-v1-1",
  "design_version": "V1.1",
  "status": "COMPLETE",
  "ready_for_hybrid_rerank_implementation": true,
  "supersession": {
    "scope": "eligibility placement / candidate-admission ordering only",
    "predecessor": {
      "path": "evals/rag_real_world_corpus/v1/ablation_design_v1/ablation_design_manifest.json",
      "sha256": "4c3b2e294b63dcc0ae57be1d30d713b3cf1ffed5b0f3a989499f1298902703c6"
    },
    "audit_authority": {
      "path": "RAG_ELIGIBILITY_PLACEMENT_AUDIT_V1.md",
      "sha256": "8e31f700d4d1a4d18ef102b38b13681eedfa02d7ea24fd641fd566c886f66f8b"
    },
    "unrelated_v1_fields_changed": false
  },
  "scope_declarations": {
    "design_only": true,
    "hybrid_implemented": false,
    "reranker_implemented": false,
    "experimental_llm_calls": 0,
    "model_downloads": 0,
    "reranker_instantiations": 0,
    "reranker_inference_calls": 0,
    "embedding_executions": 0,
    "faiss_experimental_executions": 0,
    "bm25_executions": 0,
    "baseline_rerun": false,
    "production_rag_modified": false,
    "gold_modified": false,
    "corpus_modified": false,
    "parameter_tuning_performed": false
  },
  "frozen_inputs": {
    "manifest_schema": {
      "path": "evals/rag_real_world_corpus/v1/ablation_design_v1_1/ablation_design_manifest.schema.json",
      "sha256": "929fe7aeff73554c921f6a55eb9de35d7ab4996a240e3f357f02875d9eba6820"
    },
    "gold": {
      "path": "evals/rag_real_world_corpus/v1/gold/v1/gold_cases.json",
      "sha256": "33a0b69901fa47e3fe45be0277228cd4a5519fe780fe5b9d2c52b1bfe614927a",
      "case_count": 72,
      "claim_count": 132
    },
    "freeze_manifest": {
      "path": "evals/rag_real_world_corpus/v1/gold/v1/gold_dataset_v1_freeze_manifest.json",
      "sha256": "d979079be4eb901a825ab29414dd7b5124d030182e09b55eea1e93749c12a5c2"
    },
    "corpus_manifest": {
      "path": "evals/rag_real_world_corpus/v1/corpus_manifest.json",
      "sha256": "6f67d510cd35197f107400d33033972c0c3c84478174e4991e491f6c8e4ab563",
      "document_count": 11,
      "runtime_chunk_count": 442
    },
    "dense_control": {
      "run_id": "20260814T052007Z-593cd2ac",
      "run_manifest_path": "evals/rag_real_world_corpus/v1/results/dense_only_baseline_v1/20260814T052007Z-593cd2ac/run_manifest.json",
      "run_manifest_sha256": "9b19c9c223d10d8bb7e81087adcf1a394874d8c7f89304cf0a847be8169c37b0",
      "raw_results_path": "evals/rag_real_world_corpus/v1/results/dense_only_baseline_v1/20260814T052007Z-593cd2ac/raw_results.json",
      "raw_results_sha256": "bf718aed08e226149c9310cbf20bf25c403708217e2908789120178ac5574e28",
      "reuse_without_rerun": true,
      "rerun_only_if_execution_is_proven_invalid": true
    },
    "failure_analysis": {
      "manifest_path": "evals/rag_real_world_corpus/v1/failure_analysis_v1/failure_analysis_manifest.json",
      "manifest_sha256": "e869fd73e2570413595c1af194b6ec6876e8b822fbd4eac279541a03cac27fb8",
      "ablation_hypotheses_path": "evals/rag_real_world_corpus/v1/failure_analysis_v1/ablation_hypotheses.json",
      "ablation_hypotheses_sha256": "27184ff8ddbf628f78767ede545e202ee66cb9ff17f56728961a8ce2d801f610",
      "addressability_matrix_sha256": "877d2ba3948e5bdcf530307b4719cd46df74ae5c4680547fab7fa09374f31726",
      "case_analysis_sha256": "406527bcb6b7efeea885175bb9ea5f99af1b3bf91ccc0c79711d88854bc57b1e"
    },
    "production_code_binding": {
      "source_manifest_path": "evals/rag_real_world_corpus/v1/failure_analysis_v1/failure_analysis_manifest.json",
      "binding_field": "frozen_bindings.production_code.baseline_sha256",
      "file_count": 15,
      "all_files_match_on_v1_1_design_freeze": true
    }
  },
  "arms": {
    "dense_only": {
      "role": "A — frozen control; reuse the frozen run and never rerun it for this ablation.",
      "stage_order": [
        "raw_dense_top_18",
        "dense_branch_admission_score_gte_0_35",
        "overlap_dedup",
        "document_diversity_first_pass_max_3_per_material",
        "rank_ordered_backfill",
        "final_top_6_and_context_budget",
        "generation",
        "citation_validation"
      ],
      "raw_dense_limit": 18,
      "raw_bm25_limit": null,
      "union_identity_limit": null,
      "fused_limit": null,
      "reranker_input_limit": null,
      "no_padding_or_refill": true,
      "governance_ref": "#/governance_contract"
    },
    "hybrid": {
      "role": "B — isolate lexical complement using branch admission before deterministic fusion.",
      "stage_order": [
        "raw_dense_top_18",
        "dense_branch_admission_score_gte_0_35",
        "raw_bm25_top_18",
        "bm25_top_18_membership_admission",
        "admitted_identity_union_dedup_preserving_all_observed_provenance",
        "rrf_k_60_over_admitted_branch_contributions_only",
        "fused_top_18",
        "overlap_dedup",
        "document_diversity_first_pass_max_3_per_material",
        "rank_ordered_backfill",
        "final_top_6_and_context_budget",
        "generation",
        "citation_validation"
      ],
      "raw_dense_limit": 18,
      "raw_bm25_limit": 18,
      "union_identity_limit": 36,
      "fused_limit": 18,
      "reranker_input_limit": null,
      "no_padding_or_refill": true,
      "governance_ref": "#/governance_contract"
    },
    "dense_rerank": {
      "role": "C — isolate reranker ordering on exactly the candidates admitted by frozen Dense semantics.",
      "stage_order": [
        "raw_dense_top_18",
        "dense_branch_admission_score_gte_0_35",
        "rerank_all_dense_admitted_candidates_max_18",
        "overlap_dedup",
        "document_diversity_first_pass_max_3_per_material",
        "rank_ordered_backfill",
        "final_top_6_and_context_budget",
        "generation",
        "citation_validation"
      ],
      "raw_dense_limit": 18,
      "raw_bm25_limit": null,
      "union_identity_limit": null,
      "fused_limit": null,
      "reranker_input_limit": 18,
      "no_padding_or_refill": true,
      "governance_ref": "#/governance_contract"
    },
    "hybrid_rerank": {
      "role": "D — compose admitted Hybrid recall with reranker ordering; no superiority is presumed.",
      "stage_order": [
        "raw_dense_top_18",
        "dense_branch_admission_score_gte_0_35",
        "raw_bm25_top_18",
        "bm25_top_18_membership_admission",
        "admitted_identity_union_dedup_preserving_all_observed_provenance",
        "rrf_k_60_over_admitted_branch_contributions_only",
        "fused_top_18",
        "rerank_all_fused_candidates_max_18",
        "overlap_dedup",
        "document_diversity_first_pass_max_3_per_material",
        "rank_ordered_backfill",
        "final_top_6_and_context_budget",
        "generation",
        "citation_validation"
      ],
      "raw_dense_limit": 18,
      "raw_bm25_limit": 18,
      "union_identity_limit": 36,
      "fused_limit": 18,
      "reranker_input_limit": 18,
      "no_padding_or_refill": true,
      "governance_ref": "#/governance_contract"
    }
  },
  "admission_contract": {
    "selected_option": "B_BRANCH_ELIGIBILITY_BEFORE_FUSION",
    "candidate_construction_not_governance": true,
    "dense_branch_rule": "branch_admitted_dense = dense_rank IS NOT NULL AND dense_score >= 0.35",
    "bm25_branch_rule": "branch_admitted_bm25 = bm25_rank IS NOT NULL AND bm25_rank <= 18",
    "candidate_rule": "candidate_admitted = branch_admitted_dense OR branch_admitted_bm25",
    "required_fields": {
      "branch_admitted_dense": "boolean",
      "branch_admitted_bm25": "boolean",
      "candidate_admitted": "boolean",
      "admission_basis": "DENSE_THRESHOLD | BM25_TOP18 | BOTH | NONE",
      "dense_score": "number or null; raw observed value",
      "dense_rank": "integer or null; raw observed branch rank",
      "bm25_score": "number or null; raw observed value",
      "bm25_rank": "integer or null; raw observed branch rank",
      "dense_fusion_rank": "integer or null; null when Dense did not admit",
      "bm25_fusion_rank": "integer or null; null when BM25 did not admit"
    },
    "unavailable_value_rule": "A value not observed in a branch remains null.",
    "observed_but_nonadmitting_rule": "Observed raw score/rank provenance is retained even when that branch does not admit the candidate; only that branch's fusion-rank contribution becomes null.",
    "identity_merge_rule": "Deduplicate by stable runtime chunk identity after branch admission and before RRF; fail on identity/content-hash collision.",
    "dual_hit_example": {
      "dense_score": 0.31,
      "dense_rank": 8,
      "bm25_score": "actual observed BM25 value",
      "bm25_rank": 3,
      "branch_admitted_dense": false,
      "branch_admitted_bm25": true,
      "candidate_admitted": true,
      "admission_basis": "BM25_TOP18",
      "dense_fusion_rank": null,
      "bm25_fusion_rank": 3,
      "rrf_contributing_branches": ["bm25"]
    }
  },
  "candidate_budget": {
    "raw_dense_top_18": "First 18 raw Dense retrieval results before dense admission.",
    "raw_bm25_top_18": "First 18 raw lexical retrieval results; membership is BM25 admission.",
    "maximum_branch_admitted_entries_before_identity_dedup": 36,
    "maximum_admitted_union_identities_after_identity_dedup": 36,
    "fused_top_18": "First at most 18 admitted union identities after deterministic RRF ordering.",
    "dense_rerank_input": "All Dense-admitted identities from raw Dense Top 18; count is <=18.",
    "hybrid_rerank_input": "Fused Top 18 admitted identities; count is <=18.",
    "limit_is_maximum_not_padding_requirement": true,
    "dense_rank_greater_than_18_refill_forbidden": true,
    "underfill_example": "If only 12 raw Dense Top-18 candidates meet 0.35, C reranks 12 and never fetches ranks 19+."
  },
  "score_contract": {
    "dense_score": "Dense branch admission only: dense_score >= 0.35.",